NtsbNo,EventType,Mkey,EventDate,City,State,Country,ReportNo,N,HasSafetyRec,ReportType,OriginalPublishDate,HighestInjuryLevel,FatalInjuryCount,SeriousInjuryCount,MinorInjuryCount,ProbableCause,EventID,Latitude,Longitude,Make,Model,AirCraftCategory,AirportID,AirportName,AmateurBuilt,NumberOfEngines,Scheduled,PurposeOfFlight,FAR,AirCraftDamage,WeatherCondition,Operator,ReportStatus,RepGenFlag,DocketUrl,DocketPublishDate,...38,first_bad_date,second_bad_date
ERA24LA299,ACC,194658,2024-07-04T16:00:00Z,Frankford,Delaware,United States,NA,N749SK,FALSE,DirectorBrief,NA,Minor,0,0,1,NA,NA,0,0,BELLANCA,8GCBC,NA,NA,NA,FALSE,NA,NA,BANT,091,NA,NA,OCEAN AERIAL ADS INC,In work,FALSE,NA,NA,NA,7/4/2024,4-7-2024
ERA24LA264,ACC,194484,2024-06-14T12:45:00Z,Townsend,Delaware,United States,NA,N298Z,FALSE,DirectorBrief,2024-09-04T04:00:00Z,Serious,0,1,0,"An inadvertent encounter with rough or soft terrain during landing, resulting in a bent nose landing gear leg and subsequent nose over.",NA,39.373611,-75.745833,VANS,RV6,AIR,DE20,Spirit Airpark,TRUE,1,NA,PERS,091,Substantial,VMC,NA,Completed,FALSE,https://data.ntsb.gov/Docket?ProjectID=194484,9/4/2024 5:00:00 PM,NA,6/14/2024,14-6-2024
ERA22LA415,ACC,105934,2022-08-25T16:48:00Z,Georgetown,Delaware,United States,NA,N5132C,FALSE,DirectorBrief,2022-11-01T04:00:00Z,None,0,0,0,The pilot's failure to extend the landing gear before landing. Contributing to the accident was an inoperative landing gear warning horn.,NA,38.689346,-75.36054,CESSNA,T210N,AIR,GED,Delaware Coastal,FALSE,1,NA,PERS,091,Substantial,VMC,BERNARD A HECKMAN MD PA,Completed,FALSE,https://data.ntsb.gov/Docket?ProjectID=105934,10/13/2022 7:00:00 PM,NA,8/25/2022,25-8-2022
ERA21LA058,ACC,102353,2020-11-28T12:43:00Z,Georgetown,Delaware,United States,NA,N7596B,FALSE,DirectorBrief,2021-08-20T04:00:00Z,None,0,0,0,The pilot’s failure to maintain airplane control while on landing in gusting crosswind conditions.,NA,38.686587,-75.360774,CHAMPION,7FC,AIR,GED,Delaware Coastal Airport,FALSE,1,NA,PERS,091,Substantial,VMC,NA,Completed,FALSE,https://data.ntsb.gov/Docket?ProjectID=102353,5/18/2021 7:00:00 PM,NA,11/28/2020,28-11-2020
ERA20CA318,ACC,101970,2020-09-07T15:42:00Z,Wilmington,Delaware,United States,NA,N19813,FALSE,DirectorBrief,2021-06-24T04:00:00Z,None,0,0,0,"The student pilot’s improper landing flare, which resulted in a hard bounced landing.",NA,39.67652,-75.603042,Cessna,172,AIR,ILG,New Castle Airport,FALSE,1,NA,INST,091,Substantial,VMC,Boeing Employees Flying Assn Inc,Completed,FALSE,https://data.ntsb.gov/Docket?ProjectID=101970,12/9/2021 5:00:00 AM,NA,9/7/2020,7-9-2020
ERA20CA298,ACC,101878,2020-08-27T14:00:00Z,Milton,Delaware,United States,NA,N628JB,FALSE,DirectorBrief,2021-06-24T04:00:00Z,Minor,0,0,0,"The pilot and owner’s failure to adequately communicate and establish an understanding of who was flying the airplane, and their failure to take timely action to avoid a collision with terrain.",NA,38.810276,-75.237777,Vans,RV6,AIR,DE25,Eagle Crest-Hudson,TRUE,1,NA,PERS,091,Substantial,VMC,NA,Completed,FALSE,https://data.ntsb.gov/Docket?ProjectID=101878,4/19/2021 7:00:00 PM,NA,8/27/2020,27-8-2020
ERA20CA117,ACC,101023,2020-02-29T10:25:00Z,Wilmington,Delaware,United States,NA,N228JS,FALSE,DirectorBrief,2020-06-29T04:00:00Z,Serious,0,1,0,"The pilot being struck in the head by the propeller before flight, which resulted in a serious injury.",NA,39.678611,-75.606666,Piper,PA28,AIR,ILG,New Castle,FALSE,1,NA,PERS,091,None,VMC,NA,Completed,FALSE,https://data.ntsb.gov/Docket?ProjectID=101023,4/13/2020 12:11:00 PM,NA,2/29/2020,29-2-2020
ERA19FA250,ACC,100075,2019-08-18T08:51:00Z,Wilmington,Delaware,United States,NA,N678DM,FALSE,DirectorBrief,2021-06-24T04:00:00Z,Fatal,2,0,0,"The pilots’ failure to place the left fuel selector into the proper position, which resulted in a total loss of the left engine’s power due to fuel starvation. Contributing was their failure to properly secure the left engine and their failure to maintain control of the airplane during the attempt to return to the airport.",NA,39.690555,-75.638336,Beech,95B55,AIR,ILG,New Castle,FALSE,2,NA,INST,091,Substantial,VMC,NA,Completed,FALSE,https://data.ntsb.gov/Docket?ProjectID=100075,6/8/2021 7:00:00 PM,NA,8/18/2019,18-8-2019
