NtsbNo,EventType,Mkey,EventDate,City,State,Country,ReportNo,N,HasSafetyRec,ReportType,OriginalPublishDate,HighestInjuryLevel,FatalInjuryCount,SeriousInjuryCount,MinorInjuryCount,ProbableCause,EventID,Latitude,Longitude,Make,Model,AirCraftCategory,AirportID,AirportName,AmateurBuilt,NumberOfEngines,Scheduled,PurposeOfFlight,FAR,AirCraftDamage,WeatherCondition,Operator,ReportStatus,RepGenFlag,DocketUrl,DocketPublishDate,...38,first_bad_date,second_bad_date
CEN24LA341,ACC,195074,2024-09-07T10:30:00Z,Trojan,South Dakota,United States,NA,N95078,FALSE,DirectorBrief,NA,None,0,0,0,NA,NA,0,0,TAYLORCRAFT,BC12-D,NA,NA,NA,FALSE,NA,NA,PERS,091,NA,VMC,NA,In work,FALSE,NA,NA,NA,9/7/2024,7-9-2024
CEN24FA295,ACC,194815,2024-07-31T07:20:00Z,Irene,South Dakota,United States,NA,N903US,FALSE,DirectorBrief,NA,Fatal,1,0,0,NA,NA,43.072519,-97.215119,PIPER,PA-28-180,AIR,NA,NA,FALSE,1,NA,PERS,091,Destroyed,IMC,NA,In work,FALSE,NA,NA,NA,7/31/2024,31-7-2024
CEN24LA229,ACC,194490,2024-06-13T15:55:00Z,White,South Dakota,United States,NA,N1746S,FALSE,DirectorBrief,2024-08-22T04:00:00Z,Minor,0,0,1,"A low-level collision and engine ingestion with ducks, which resulted in a total loss of engine power, a forced landing, and a subsequent nose over.",NA,44.515727,-96.736499,AERO COMMANDER,S2R,AIR,NA,NA,FALSE,1,NA,AAPL,137,Substantial,VMC,WILDE AIR SERVICE LLC,Completed,FALSE,https://data.ntsb.gov/Docket?ProjectID=194490,8/22/2024 5:00:00 PM,NA,6/13/2024,13-6-2024
CEN24LA121,ACC,193836,2024-02-25T17:10:00Z,Watertown,South Dakota,United States,NA,N38696,FALSE,DirectorBrief,NA,None,0,0,0,NA,NA,44.916092,-97.154862,PIPER,PA-28-181,AIR,ATY,NA,FALSE,1,NA,INST,091,Substantial,VMC,LAKE AREA TECHNICAL COLLEGE,In work,FALSE,NA,NA,NA,2/25/2024,25-2-2024
CEN24LA076,ACC,193583,2023-12-29T13:00:00Z,Vermillion,South Dakota,United States,NA,N2774P,FALSE,DirectorBrief,NA,None,0,0,0,NA,NA,42.76879,-96.941175,PIPER,PA-18A 150,AIR,MVR,Harold Davidson Field Airport,FALSE,1,NA,PERS,091,Substantial,VMC,RIVER SOLUTIONS LLC,In work,FALSE,NA,NA,NA,12/29/2023,29-12-2023
CEN24LA020,ACC,193291,2023-10-23T16:11:00Z,Pierre,South Dakota,United States,NA,N92884,FALSE,DirectorBrief,NA,Fatal,1,1,0,NA,NA,44.398414,-100.37172,PIPER,PA 46-350P,AIR,KPIR,NA,FALSE,1,NA,PERS,091,Substantial,VMC,NA,In work,FALSE,NA,NA,NA,10/23/2023,23-10-2023
CEN23LA334,ACC,192747,2023-07-27T14:30:00Z,Aberdeen,South Dakota,United States,NA,N8503W,FALSE,DirectorBrief,NA,None,0,0,0,NA,NA,45.441366,-98.42646,AIR TRACTOR INC,AT-802A,AIR,ABR,ABERDEEN RGNL,FALSE,1,NA,NA,137,Substantial,VMC,PIONEER AGVIATION 2 LLC,In work,FALSE,NA,NA,NA,7/27/2023,27-7-2023
CEN23LA302,ACC,192621,2023-07-12T06:48:00Z,Custer,South Dakota,United States,NA,N605KD,FALSE,DirectorBrief,2023-10-17T04:00:00Z,Serious,0,1,0,"The pilot’s weather encounter that resulted in a high speed landing, the balloon tipping over, and serious injury to a passenger.",NA,43.7667,-103.5988,ARBC INC DBA LINDSTRAND,260A,BALL,NA,NA,FALSE,0,NSCH,AOBV,091,None,VMC,Flying Circus Inc,Completed,FALSE,NA,NA,NA,7/12/2023,12-7-2023
CEN23LA244,ACC,192396,2023-06-18T13:30:00Z,Sturgis,South Dakota,United States,NA,N290LA,FALSE,DirectorBrief,2023-07-27T04:00:00Z,None,0,0,0,The pilot’s improper timing to initiate beta mode with the propeller and his failure to maintain directional during the full load landing that resulted in a runway excursion. Contributing to the accident was the pilot’s lack of recent experience with performing a full load landing and the high-density altitude that likely affected aircraft performance during the landing.,NA,44.41817,-103.37577,AIR TRACTOR INC,AT-502,AIR,49B,STURGIS MUNI,FALSE,1,NA,AAPL,137,Substantial,VMC,ASCEND AG INC,Completed,FALSE,https://data.ntsb.gov/Docket?ProjectID=192396,7/27/2023 5:00:00 PM,NA,6/18/2023,18-6-2023
CEN23LA175,ACC,114702,2023-05-04T18:30:00Z,Brookings,South Dakota,United States,NA,N1674E,FALSE,DirectorBrief,2023-06-29T04:00:00Z,None,0,0,0,"The student pilot’s failure to maintain pitch and directional control during the takeoff roll. Contributing to the accident, was the student pilot’s delay in relinquishing control of the airplane and the instructor's delayed reaction before the loss of directional control.",NA,44.306876,-96.822444,CESSNA,172S,AIR,KBKX,Brookings Regional,FALSE,1,NA,INST,091,Substantial,VMC,South Dakota State University,Completed,FALSE,https://data.ntsb.gov/Docket?ProjectID=114702,6/29/2023 5:00:00 PM,NA,5/4/2023,4-5-2023
CEN23LA030,ACC,106264,2022-11-06T14:30:00Z,Murdo,South Dakota,United States,NA,N699XM,FALSE,DirectorBrief,2023-02-23T05:00:00Z,None,0,0,0,The pilot’s failure to maintain directional control during takeoff with strong gusty surface winds.,NA,43511185,-1004241,CESSNA,182Q,AIR,8F6,Murdo Municipal Airport,FALSE,1,NSCH,PERS,091,Substantial,VMC,NA,Completed,FALSE,https://data.ntsb.gov/Docket?ProjectID=106264,2/23/2023 7:00:00 PM,NA,11/6/2022,6-11-2022
CEN22FA433,ACC,106005,2022-09-27T10:15:00Z,Yankton,South Dakota,United States,NA,N499AG,FALSE,DirectorBrief,2024-03-20T04:00:00Z,Fatal,1,0,0,"A loss of control while an in-flight fire occurred, which resulted in an impact with terrain. Contributing to the accident was the pilot/builder’s improper engine build procedures.",NA,42.946938,-97.43629,AIRGYRO,AG915,GYRO,NA,NA,TRUE,1,NA,FLTS,091,Destroyed,VMC,NA,Completed,FALSE,https://data.ntsb.gov/Docket?ProjectID=106005,3/20/2024 5:00:00 PM,NA,9/27/2022,27-9-2022
CEN22LA313,ACC,105449,2022-07-10T18:10:00Z,Rapid City,South Dakota,United States,NA,N478WT,FALSE,DirectorBrief,2023-09-14T04:00:00Z,None,0,0,0,A total loss of engine power for reasons that could not be determined because the airplane was unavailable for examination.,NA,44.044227,-103.07879,PIPER,PA-24-260,AIR,RAP,NA,FALSE,1,NA,PERS,091,Substantial,VMC,NA,Completed,FALSE,https://data.ntsb.gov/Docket?ProjectID=105449,9/14/2023 5:00:00 PM,NA,7/10/2022,10-7-2022
CEN22LA245,ACC,105250,2022-06-10T16:23:00Z,Sioux Falls,South Dakota,United States,NA,N201FM,FALSE,DirectorBrief,2022-07-20T04:00:00Z,Minor,0,0,1,"The pilot’s failure to maintain directional control after an attempted go-around, which resulted in a runway excursion and impact with terrain.",NA,43.592214,-96.734917,CESSNA,305,AIR,FSD,Joe Foss Field Airport,FALSE,1,NA,PERS,091,Substantial,VMC,NA,Completed,FALSE,https://data.ntsb.gov/Docket?ProjectID=105250,6/29/2022 4:00:00 AM,NA,6/10/2022,10-6-2022
CEN22LA238,ACC,105228,2022-06-08T06:45:00Z,Hot Springs,South Dakota,United States,NA,N9158Z,FALSE,DirectorBrief,2022-07-20T04:00:00Z,Serious,0,1,0,The passenger lost her grip during landing in a balloon which resulted in her hitting the ground with her shoulder and suffering a serious injury.,NA,43.368306,-103.38827,AEROSTAR INTERNATIONAL INC,RX 8,BALL,None,Hot Springs,FALSE,0,NSCH,AOBV,091,None,VMC,NA,Completed,FALSE,https://data.ntsb.gov/Docket?ProjectID=105228,6/29/2022 4:00:00 AM,NA,6/8/2022,8-6-2022
CEN22LA257,ACC,105285,2022-06-05T11:35:00Z,Gettysburg,South Dakota,United States,NA,N901BW,FALSE,DirectorBrief,2024-08-21T04:00:00Z,None,0,0,0,An inadvertent hard landing by the pilot.,NA,44.986611,-99.952889,PIPER,PA-32R-300,AIR,0D8,Gettysburg Municipal,FALSE,1,NA,PERS,091,Substantial,VMC,NA,Completed,FALSE,https://data.ntsb.gov/Docket?ProjectID=105285,8/21/2024 5:00:00 PM,NA,6/5/2022,5-6-2022
CEN22FA109,ACC,104569,2022-01-30T18:10:00Z,Oral,South Dakota,United States,NA,N3177F,FALSE,DirectorBrief,2022-08-31T04:00:00Z,Fatal,1,0,0,"The noncertificated pilot’s failure to maintain control of the airplane, which led to the airplane exceeding its critical angle-of-attack and subsequent aerodynamic stall. Contributing to the accident was the pilot’s decision to attempt a flight with no previous flight experience.",NA,43.375175,-103.29778,Christavia,MK1,AIR,PVT,NA,TRUE,1,NA,PERS,091,Substantial,VMC,NA,Completed,FALSE,https://data.ntsb.gov/Docket?ProjectID=104569,4/28/2022 4:00:00 PM,NA,1/30/2022,30-1-2022
CEN21LA416,ACC,103845,2021-09-10T10:40:00Z,Hot Springs,South Dakota,United States,NA,N9343B,FALSE,DirectorBrief,2023-03-01T05:00:00Z,None,0,0,0,"The tensile overload failure of the main landing gear attachment bolt, which resulted in separation of the left main landing gear and a loss of control during landing.",NA,43.430346,-103.47618,CESSNA,175,AIR,HSR,HOT SPRINGS MUNI,FALSE,1,NA,PERS,091,Substantial,VMC,NA,Completed,FALSE,https://data.ntsb.gov/Docket?ProjectID=103845,2/1/2023 5:00:00 AM,NA,9/10/2021,10-9-2021
CEN21LA316,ACC,103461,2021-07-11T09:15:00Z,Eagle Butte,South Dakota,United States,NA,N5340R,FALSE,DirectorBrief,2022-11-01T04:00:00Z,None,0,0,0,A total loss of engine power due to the fatigue failure of the No. 6 connecting rod.,NA,44.989766,-101.2589,CESSNA,172F,AIR,84D,NA,FALSE,1,NA,PERS,091,Substantial,VMC,NA,Completed,FALSE,https://data.ntsb.gov/Docket?ProjectID=103461,10/13/2022 4:00:00 AM,NA,7/11/2021,11-7-2021
CEN21LA082,ACC,102397,2020-12-08T12:00:00Z,Spearfish,South Dakota,United States,NA,N2554M,FALSE,DirectorBrief,2022-07-07T04:00:00Z,None,0,0,0,A total loss of engine power during initial climb for undetermined reasons.,NA,44.481056,-103.786,PIPER,PA12,AIR,SPF,Black Hills Airport-Clyde Ice Field,FALSE,1,NSCH,FLTS,091,Substantial,VMC,NA,Completed,FALSE,https://data.ntsb.gov/Docket?ProjectID=102397,6/15/2022 4:00:00 AM,NA,12/8/2020,8-12-2020
CEN21LA022,ACC,102169,2020-10-18T11:00:00Z,Spearfish,South Dakota,United States,NA,N97875,FALSE,DirectorBrief,2022-05-19T04:00:00Z,None,0,0,0,The snowplow driver’s failure to see the airplane which resulted in a collision with the airplane.,NA,44.4908,-103.8594,CESSNA,182Q,AIR,SPF,Black Hills Airport-Clyde Ice Field,FALSE,1,NSCH,PERS,091,Substantial,VMC,NA,Completed,FALSE,https://data.ntsb.gov/Docket?ProjectID=102169,4/26/2022 4:00:00 PM,NA,10/18/2020,18-10-2020
CEN20LA389,ACC,101956,2020-09-13T11:00:00Z,Groton,South Dakota,United States,NA,N83DH,FALSE,DirectorBrief,2022-06-21T04:00:00Z,Fatal,2,0,0,The pilot’s loss of airplane control during a low-altitude aerobatic maneuver.,NA,45.52861,-98.093055,Champion,8KCAB,AIR,2E6,Groton Muni,FALSE,1,NA,PERS,091,Substantial,VMC,NA,Completed,FALSE,https://data.ntsb.gov/Docket?ProjectID=101956,6/13/2022 4:00:00 AM,NA,9/13/2020,13-9-2020
CEN20CA344,ACC,101808,2020-08-15T20:00:00Z,White Owl,South Dakota,United States,NA,N6643Y,FALSE,DirectorBrief,2021-02-02T05:00:00Z,None,0,0,0,"The pilot's failure to maintain directional control during the takeoff, which resulted in a runway excursion and subsequent impact with an obstacle and terrain.",NA,44.604721,-102.38861,Beech,35,AIR,None,Private Airstrip,FALSE,1,NA,PERS,091,Substantial,VMC,NA,Completed,FALSE,https://data.ntsb.gov/Docket?ProjectID=101808,10/9/2020 6:31:44 PM,NA,8/15/2020,15-8-2020
CEN20LA309,ACC,101679,2020-07-27T10:45:00Z,Corsica,South Dakota,United States,NA,N53163,FALSE,DirectorBrief,2022-05-06T04:00:00Z,Fatal,1,0,0,"The pilot’s exceedance of the airplane’s critical angle of attack, which resulted in an aerodynamic stall and loss of control.",NA,43.428333,-98.244445,Cessna,A188,AIR,D65,Corsica Municipal,FALSE,1,NSCH,AAPL,091,Destroyed,VMC,NA,Completed,FALSE,https://data.ntsb.gov/Docket?ProjectID=101679,4/28/2022 4:00:00 PM,NA,7/27/2020,27-7-2020
CEN20LA215,ACC,101397,2020-06-07T04:25:00Z,Sioux Falls,South Dakota,United States,NA,N44MX,FALSE,DirectorBrief,2022-03-30T04:00:00Z,Fatal,1,0,0,The pilot’s failure to maintain control of the airplane during takeoff for reasons that could not be determined.,NA,43.58139,-96.743614,Mitsubishi,MU2B,AIR,FSD,Joe Foss Field,FALSE,2,NSCH,BUS,135,Destroyed,VMC,"McNeely Charter Service, Inc.",Completed,FALSE,https://data.ntsb.gov/Docket?ProjectID=101397,3/4/2022 5:00:00 PM,NA,6/7/2020,7-6-2020
CEN20CA086,ACC,100952,2020-02-15T10:13:00Z,Huron,South Dakota,United States,NA,N2019A,FALSE,DirectorBrief,2020-08-25T04:00:00Z,None,0,0,0,"The pilot's failure to maintain adequate airspeed during final approach, which resulted in the airplane exceeding its critical angle of attack and a subsequent aerodynamic stall at too low of an altitude to recover.",NA,44.379722,-98.218612,Cessna,182,AIR,HON,HURON RGNL,FALSE,1,NA,PERS,091,Substantial,VMC,NA,Completed,FALSE,https://data.ntsb.gov/Docket?ProjectID=100952,3/26/2020 2:19:00 PM,NA,2/15/2020,15-2-2020
CEN20FA022,ACC,100636,2019-11-30T13:33:00Z,Chamberlain,South Dakota,United States,NA,N56KJ,FALSE,DirectorBrief,2022-05-19T04:00:00Z,Fatal,9,3,0,"The pilot’s loss of control shortly after takeoff, which resulted in an inadvertent, low-altitude aerodynamic stall.  Contributing to the accident was the pilot’s improper loading of the airplane, which resulted in reduced static longitudinal stability and his decision to depart into low instrument meteorological conditions.",NA,43.765556,-99.337219,Pilatus,PC12,AIR,9V9,Chamberlain Muni,FALSE,1,NSCH,PERS,091,Destroyed,IMC,NA,Completed,FALSE,https://data.ntsb.gov/Docket?ProjectID=100636,4/29/2022 4:00:00 PM,NA,11/30/2019,30-11-2019
CEN20FA010,ACC,100465,2019-10-09T22:35:00Z,Aberdeen,South Dakota,United States,NA,N6483B,FALSE,DirectorBrief,2022-02-16T05:00:00Z,Fatal,1,0,0,"The noncertificated pilot’s decision to fly in dark night instrument conditions, resulting in impact with terrain.",NA,45.561668,-98.460281,Cessna,172,AIR,ABR,Aberdeen Regional Airport,FALSE,1,NA,PERS,091,Destroyed,IMC,NA,Completed,FALSE,https://data.ntsb.gov/Docket?ProjectID=100465,1/27/2022 5:00:00 AM,NA,10/9/2019,9-10-2019
CEN19LA318,ACC,100248,2019-09-12T14:10:00Z,Hill City,South Dakota,United States,NA,N100CK,FALSE,DirectorBrief,2022-04-21T04:00:00Z,None,0,0,0,"A total loss of engine power for undetermined reasons, which resulted in a hard landing.",NA,43.932498,-103.58361,Bell,206,HELI,N/A,NA,FALSE,NA,NA,PERS,091,Substantial,VMC,NA,Completed,FALSE,https://data.ntsb.gov/Docket?ProjectID=100248,4/12/2022 4:00:00 PM,NA,9/12/2019,12-9-2019
CEN19FA307,ACC,100213,2019-09-08T00:00:00Z,Lakeview,South Dakota,United States,NA,N73000,FALSE,DirectorBrief,2021-09-16T04:00:00Z,Fatal,2,0,0,"The student pilot’s failure to maintain control of the airplane, which resulted in the exceedance of the airplane’s critical angle-of-attack, an aerodynamic stall, and subsequent impact with terrain, and the student pilot’s non-compliance and lack of experience.",NA,43.039443,-100.80555,Cessna,140,AIR,None,Private Airstrip,FALSE,1,NA,AOBV,091,Substantial,VMC,NA,Completed,FALSE,https://data.ntsb.gov/Docket?ProjectID=100213,8/26/2021 4:00:00 AM,NA,9/8/2019,8-9-2019
GAA19CA502,ACC,100105,2019-08-16T13:30:00Z,Onida,South Dakota,United States,NA,N500KA,FALSE,DirectorBrief,2020-04-13T04:00:00Z,None,0,0,0,The pilot's failure to maintain clearance from power wires during agricultural application operations.,NA,44.707778,-100.061668,Air Tractor,AT502,AIR,NA,NA,FALSE,1,NA,AAPL,137,Substantial,VMC,Wilbur Ellis Air Llc,Completed,FALSE,https://data.ntsb.gov/Docket?ProjectID=100105,12/10/2019 8:11:00 PM,NA,8/16/2019,16-8-2019
CEN19LA241,ACC,99946,2019-07-26T13:30:00Z,Mitchell,South Dakota,United States,NA,N98PW,FALSE,DirectorBrief,2021-01-28T05:00:00Z,None,0,0,0,A loss of directional control on landing for undetermined reasons.,NA,43.774723,-98.038612,Stoddard-Hamilton,GlaStar,AIR,MHE,Mitchell Municipal,TRUE,1,NA,PERS,091,Substantial,VMC,NA,Completed,FALSE,https://data.ntsb.gov/Docket?ProjectID=99946,9/30/2019 6:07:00 PM,NA,7/26/2019,26-7-2019
GAA19CA487,ACC,100008,2019-07-15T13:40:00Z,Bison,South Dakota,United States,NA,N2946D,FALSE,DirectorBrief,2020-04-13T04:00:00Z,None,0,0,0,"The pilot's improper landing flare, which resulted in a hard landing and subsequent ground loop.",NA,45.518333,-102.467781,Cessna,170,AIR,6V5,Bison Muni,FALSE,1,NA,PERS,091,Substantial,VMC,NA,Completed,FALSE,https://data.ntsb.gov/Docket?ProjectID=100008,10/23/2019 4:50:00 PM,NA,7/15/2019,15-7-2019
GAA19CA217,ACC,99300,2019-04-14T09:30:00Z,Wall,South Dakota,United States,NA,N277E,FALSE,DirectorBrief,2019-11-06T05:00:00Z,Minor,0,0,1,"The pilot's improper decision to depart from a slush-covered runway, which resulted in a loss of directional control, a runway excursion, and a subsequent nose-over.",NA,43.999443,-102.254722,Vans,VANS RV-12,AIR,6V4,WALL MUNI,TRUE,1,NA,PERS,091,Substantial,VMC,NA,Completed,FALSE,https://data.ntsb.gov/Docket?ProjectID=99300,5/13/2019 12:33:00 PM,NA,4/14/2019,14-4-2019
CEN19LA092,ACC,99047,2019-03-03T01:13:00Z,Union Center,South Dakota,United States,NA,N450AM,FALSE,DirectorBrief,2020-08-10T04:00:00Z,Minor,0,0,1,"The ambulance driver’s failure to see the helicopter’s rotating main rotor blades in dark night conditions, which resulted in the ambulance’s inadvertent collision with the helicopter. Contributing to the accident was the ambulance driver's failure to follow procedures when approaching the helicopter.",NA,44.564723,-102.661392,Bell,407,HELI,NA,NA,FALSE,1,NSCH,NA,135,Substantial,VMC,Air Methods Corp,Completed,FALSE,https://data.ntsb.gov/Docket?ProjectID=99047,1/15/2020 5:23:00 PM,NA,3/3/2019,3-3-2019
GAA19CA147,ACC,99019,2019-02-23T15:30:00Z,Aberdeen,South Dakota,United States,NA,N37716,FALSE,DirectorBrief,2019-11-06T05:00:00Z,Minor,0,0,1,"The pilot's selection of unsuitable terrain for landing, which resulted in a nose-over.",NA,45.534721,-98.613052,Porterfield,CP 65,AIR,NA,NA,FALSE,1,NA,PERS,091,Substantial,VMC,NA,Completed,FALSE,https://data.ntsb.gov/Docket?ProjectID=99019,3/27/2019 11:22:00 AM,NA,2/23/2019,23-2-2019
CEN19LA053,ACC,98836,2019-01-13T15:25:00Z,Salem,South Dakota,United States,NA,N75191,FALSE,DirectorBrief,2020-04-20T04:00:00Z,Fatal,1,0,0,"The incapacitating effects of an acute myocardial infarction (heart attack), which resulted in the pilot's loss of airplane control and impact with terrain.",NA,43.61861,-97.381111,Piper,PA28,AIR,NA,NA,FALSE,1,NA,PERS,091,Substantial,VMC,NA,Completed,FALSE,https://data.ntsb.gov/Docket?ProjectID=98836,3/25/2020 12:56:00 PM,NA,1/13/2019,13-1-2019
